{
  "finding_id": "SCAN-20260412-007",
  "report_path": "reports/privacy/cppa-drop-audit-rulemaking-2026-04-12.md",
  "round": 1,
  "claims_checked": 14,
  "issues": [
    {
      "claim": "DROP expands to 'Delete Request and Opt-Out Platform'",
      "section": "Background: DROP and the Delete Act",
      "source_url": "https://cppa.ca.gov/regulations/drop.html",
      "issue": "Official CPPA page styles the acronym as 'Delete Request and Opt-out Platform' (lowercase 'o' in 'Opt-out'). Report uses 'Opt-Out' with capital O. Stylistic, not substantive.",
      "severity": "minor",
      "suggested_fix": "Optionally align capitalization with official CPPA styling ('Opt-out Platform').",
      "status": "open"
    }
  ],
  "resolution_status": "resolved"
}
