{
  "finding_id": "SCAN-20260407-007",
  "report_path": "reports/privacy/cppa-playon-sports-ccpa-enforcement-2026-04-07.md",
  "round": 1,
  "claims_checked": 24,
  "issues": [
    {
      "claim": "PlayOn violated the CCPA's prohibition on selling or sharing personal information of consumers aged 13-16 without affirmative opt-in consent",
      "section": "Key Facts",
      "source_url": "https://privacy.ca.gov/2026/03/youth-sports-media-company-to-pay-1-1-million-fine-change-practices-over-privacy-violations/",
      "issue": "Multiple authoritative law firm analyses (Loeb & Loeb, Richt Law Firm) state that 'the decision did not find that PlayOn Sports violated any of the special protections provided to teens or children under California law.' The settlement requires future compliance with minor-specific provisions, but the CPPA did not make a finding that PlayOn violated Section 1798.120(c)'s prohibition on selling/sharing minors' data without opt-in consent. The report presents a forward-looking compliance requirement as a found violation, which materially mischaracterizes the enforcement decision.",
      "severity": "critical",
      "suggested_fix": "Revise to: 'The settlement requires PlayOn to comply with the CCPA's prohibition on selling or sharing personal information of consumers aged 13-16 without affirmative opt-in consent, though the decision did not make a specific finding that PlayOn violated these minor-specific protections.'",
      "status": "open"
    },
    {
      "claim": "PlayOn's privacy notice had not been updated for over a year",
      "section": "Key Facts",
      "source_url": "https://www.wilmerhale.com/en/insights/blogs/wilmerhale-privacy-and-cybersecurity-law/20260319-youth-sports-media-company-to-pay-1-10-million-fine-in-cppa-enforcement-action",
      "issue": "Multiple sources (WilmerHale, Holland & Knight, Inside Privacy) report that PlayOn's privacy policy had not been updated since July 2022, meaning it was outdated for approximately 2.5 years by the end of the violation period (December 2024). Stating 'over a year' is technically true but significantly understates the duration and diminishes the severity of the notice deficiency.",
      "severity": "major",
      "suggested_fix": "Revise to: 'PlayOn's privacy notice had not been updated since July 2022 — over two and a half years — failing to meet the CCPA requirement to update privacy policies at least annually.'",
      "status": "open"
    },
    {
      "claim": "the CPPA ruled this does not satisfy CCPA requirements under Cal. Civ. Code Section 1798.120",
      "section": "Key Facts",
      "source_url": "https://codes.findlaw.com/ca/civil-code/civ-sect-1798-135/",
      "issue": "The inline text references 'Cal. Civ. Code Section 1798.120' (the consumer's right to opt out of sale) but the hyperlink URL points to FindLaw's page for Section 1798.135 (business obligations for providing opt-out mechanisms). While both sections are relevant, the mismatch between text and URL is confusing. Section 1798.135 (the linked page) is arguably more directly relevant to the business obligation to provide opt-out mechanisms.",
      "severity": "minor",
      "suggested_fix": "Either update the link text to reference Section 1798.135 (which matches the URL), or update the URL to point to the Section 1798.120 page (https://codes.findlaw.com/ca/civil-code/civ-sect-1798-120/) to match the text. Consider referencing both sections for completeness.",
      "status": "open"
    }
  ],
  "resolution_status": "issues-found"
}
